N fonctionnalité;THEME;Date Fait;Demande 1;Demande 2;Demande 3;Demande 4;Résultat 1;Résultat 2;Résultat 3;Résultat 4;Paramètre Modifié;Ecran/Impression;Type;Ticket;Version
16775;STOCK;26/05/2020;Nouveau paramètre pour alerter ou bloquer les sorties de stock (factures, conversion devis...) si quantités insuffisantes en magasin.;Si gestion existant du stock voiture, le test sera effectué sur les sorties voitures. ;;;PARAMETRES GENERAUX - STOCK - Onglet Page 5;;;;O;Ecran;Nouveauté;;2020_05_15
16770;FACTURE;20/05/2020;Lister les références inactives ou inconnues (Article + Tarif)  présentes dans les devis type.;;;;MENU LES FACTURES - Factures Devis... - Bouton Devis Type - Bouton Accès Devis Type - Bouton Références inactives / inconnues;;;;N;Ecran;Nouveauté;17281;2020_05_15
16771;STOCK;20/05/2020;Nouveau catalogue DOMUSA;;;;OK;;;;N;Ecran;Nouveauté;;2020_05_15
16768;DIVERS;18/05/2020;Automates. Possibilité de préciser pour chaque automate le jour de lancement.;Si pas de jour précisé, l'automate se lancera chaque jour.;;;OK;;;;N;Ecran;Modification;;2020_05_15
16769;STOCK;18/05/2020;Nouvel écran de modification rapide sous forme de liste de certains champs FOURNISSEUR.;Ce traitement est soumis aux droits d'autorisation fournisseur.;;;MENU STOCK - Fournisseur - Bouton Modification Rapide;;;;N;Ecran;Nouveauté;;2020_05_15
16766;DIVERS;15/05/2020;Possibilité d'envoyer des SMS pour tout type intervention;;;;FICHIERS GENERAUX - Onglet Intervention/Retour - Onglet Intervention - Cocher SMS possible;;;;N;Ecran;Nouveauté;;2020_05_01
16767;INTERVENTION;15/05/2020;Saisie partielle intervention. Ajouter le type (normal, en attente, urgente);;;;MENU LES INTERVENTIONS - Appels - Bouton Saisie - Bouton Saisie Partielle;;;;N;Ecran;Nouveauté;;2020_05_01
16760;COMPTABILITE;12/05/2020;Possibilité de définir une longueur des comptes analytiques et de cadrer par des 0;;;;PARAMETRES COMPTABILITE - Onglet Analytique;;;;O;Ecran;Nouveauté;;2020_05_01
16762;COMPTABILITE;12/05/2020;Possibilité de faire l'interface comptable des financements reçus.;;;;PARAMETRES COMPTABILITE - Onglet Règlement -  Cocher Comptabilité financement;;;;O;Ecran;Nouveauté;;2020_05_01
16763;COMPTABILITE;12/05/2020;Possibilité d'interdire des types de règlements pour les financements.;;;;PARAMETRES COMPTABILITE - Onglet Règlement -  Bouton Règlement;;;;O;Ecran;Nouveauté;;2020_05_01
16764;COMPTABILITE;12/05/2020;Dans le cas d'utilisation de code comptable spécifique pour les Clients et Tiers, possibilité de lister et d'extraire les correspondances.;;;;PARAMETRES COMPTABILITE - Onglet Comptes Auxiliaires -  Bouton Liste Correspondances;;;;N;Ecran;Nouveauté;;2020_05_01
16758;PARAMETRES;08/05/2020;Dissocier les droits d'utilisation des Bons comptoir et Bon collectif;;;;PARAMETRES AUTORISATIONS;;;;N;Ecran;Modification;;2020_05_01
16759;STOCK;08/05/2020;Possibilité d'affecter une agence à une voiture type;Possibilité de rechercher les voitures type par agence;;;OK;;;;N;Ecran;Modification;;2020_05_01
16756;FACTURE;07/05/2020;Critères de recherche sur le temps passé.;;;;MENU LES FACTURES - Factures..- Onglet Recherche 2;;;;N;Ecran;Nouveauté;;2020_05_01
16757;STOCK;07/05/2020;Possibilité de Réserver des références  (pièces ou tarif) pour un domaine d'activité;;;;FICHE TARIF - Onglet Autre;FICHE ARTICLE;;;N;Ecran;Modification;;2020_05_01
16765;FACTURE;07/05/2020;Dans l'écran Facture, affichage de la ventilation des lignes A charge et Garantie;;;;ECRAN FACTURE -  Onglet Ventilation;;;;N;Ecran;Nouveauté;;2020_05_01
16755;CONTRAT;05/05/2020;Proposition de contrat à partir de la fiche client.;Nouvel écran supplémentaire pouvant inclure remise, prélèvement...par le bouton Détail proposition.;;;PARAMETRES GENERAUX - Contrat - Onglet Individuel - Onglet Page 5 - Cocher proposition contrat nouvelle méthode;;;;O;Ecran;Modification;;2020_05_01
16752;TIERS;02/05/2020;Possibilité de rechercher un Tiers par son mail;;;;OK;;;;N;Ecran;Modification;;2020_05_01
16753;CONTRAT;02/05/2020;Formulaire contrat. Possibilité de saisir un code tarif;;;;OK;;;;N;Ecran;Modification;;2020_05_01
16754;CONTRAT;02/05/2020;Edition des attestations de TVA correspondant aux renouvellement de contrat.;Tenir compte du montant barrière.;;;OK;;;;N;Ecran;Modification;;2020_05_01
16749;STOCK;30/04/2020;Saisie des consommations avec fichier externe;;;;OK;;;;N;Ecran;Nouveauté;;2020_04_15
16751;MAILING;30/04/2020;Envoi de plusieurs mails par Mailing. Possibilité de joindre un document en pièce jointe;;;;OK;;;;N;Ecran;Modification;;2020_04_15
16750;FACTURE;29/04/2020;Possibilité de créer automatiquement les financements pour un devis ou facture.;Il faut affecter les codes financements selon les primes (CEE....);;;PARAMETRES GENERAUX - Facture - Onglet Divers 7;;;;O;Ecran;Nouveauté;;2020_04_15
16747;CLIENT;27/04/2020;Possibilité de programmer des clients ayant plusieurs VE prévues dans le contrat.;Les clients cochés Multi VE ne pourront pas être programmés dans le planning AUTO;;;PARAMETRES GENERAUX - Contrat - Onglet Général;;;;O;Ecran;Nouveauté;;2020_04_15
16748;DIVERS;27/04/2020;Possibilité de programmer plusieurs VE pour les clients cochés MULTI VE.;Possible si le paramètre Multi VE est activé (voir évolution 16747);;;MENU LES CONTRATS - Planning Entretien - Bouton Multi VE;;;;N;Ecran;Nouveauté;;2020_04_15
16761;STOCK;25/04/2020;Saisie des consommations pour les références ou familles ou sous-familles autorisées;;;;OK;;;;N;Ecran;Modification;;2020_04_15
16745;FACTURE;23/04/2020;Facture de contrat individuel. Possibilité que la date d'échéance de la facture soit la date de renouvellement.;Ce paramètre est pris en compte si le client n'a pas de conditions de règlement.;;;PARAMETRES GENERAUX - Facture - Onglet Divers 1;;;;O;Ecran;Nouveauté;;2020_04_15
16746;DIVERS;23/04/2020;Outils pour passer des nomenclatures en inactif, réaffecter des codes nomenclatures dans les fiches appareils.;Réservé ADMINISTRATEUR;;;MENU LES FICHIERS - Nomenclature - Bouton Réaffecter Code Nomenclature;;;;O;Ecran;Nouveauté;;2020_04_15
16743;STOCK;22/04/2020;Outils pour consulter toutes les factures/avoirs liés aux commandes;;;;MENU STOCK - Articles - Bouton Mouvement - Bouton Commande - Bouton Voir Facture/Avoir Commande;;;;N;Ecran;Nouveauté;;2020_04_15
16744;STOCK;22/04/2020;Outils pour mettre à jour Famille, sous-famille, mini, maxi par fichier externe.;;;;MENU STOCK - Articles - Bouton Outils - Bouton Maj Famille - Sous Famille - Mini;;;;N;Ecran;Nouveauté;;2020_04_15
16739;PERSONNEL;21/04/2020;Possibilité d'alerter si le véhicule du technicien atteint la date ou le kilométrage du prochain entretien.;;;;PARAMETRES AUTORISATIONS - Onglet Alertes;;;;O;Ecran;Modification;;2020_04_15
16740;CLIENT;21/04/2020;Pour plus de visibilité, les dates de résiliation, arrêt contrat et motif ont été déplacés dans un onglet;;;;FICHE CLIENT - Onglet Contrat - Onglet Individuel - Onglet Résiliation;;;;N;Ecran;Modification;;2020_04_15
16741;CLIENT;21/04/2020;Le motif de remise contrat peut-être libre, soit selon le code remise, soit pour toute remise;;;;PARAMETRES GENERAUX  -  Contrat - Onglet Individuel - Onglet Page 3 (pour toute remise) ;FICHIERS GENERAUX - Onglet Type - Onglet Motif Remise;;;O;Ecran;Modification;;2020_04_15
16742;DIVERS;21/04/2020;Alertes véhicules, appareils de mesures.. contenues dans les paramètres autorisations.;Ces alertes peuvent également s'afficher pour l'ADMINISTRATEUR;Il faut alors préciser à quel utilisateur alertes l'administrateur est rattaché.;;PARAMETRES GENERAUX - Divers - Onglet Page 4. Renseigner l'Alerte administrateur ;;;;O;Ecran;Modification;;2020_04_15
16737;COMPTABILITE;20/04/2020;Nouveau paramètre de libellé d'écriture;N° Facture + Taux TVA + Nom + Prénom;;;PARAMETRES - COMPTABILITE - Onglet Libellé écritures;;;;O;Ecran;Nouveauté;;2020_04_15
16738;APPAREIL;20/04/2020;Création rapide client. Possibilité de sasisir la quantité appareil.;;;;OK;;;;N;Ecran;Modification;;2020_04_15
16735;CLIENT;17/04/2020;Possibilité d'envoyer des SMS, selon critères de sélection ou par saisie de clients ou par fichier externe;Avoir l'option SMS;;;MENU LES CLIENTS - Divers - Traitement + Editions  - Bouton Envoi SMS;;;;N;Ecran;Nouveauté;;2020_04_15
16736;CLIENT;17/04/2020;Nouveau critère de sélection. Client avec ou sans téléphone mobile;;;;MENU LES CLIENTS - Client - Onglet Complément;;;;N;Ecran;Nouveauté;;2020_04_15
16734;CLIENT;16/04/2020;Possibilité de consulter la table CONTACT avec critères de sélection;La table CONTACT est l'historique de toutes les éditions envoyées au client (AVP, Renouvellement, Relance, Courrier....);;;MENU LES CLIENTS - Divers - Traitement + Editions  - Bouton Contact;;;;N;Ecran;Nouveauté;;2020_04_15
16773;STOCK;15/04/2020;Possibilité d'exporter/importer la base article pour mettre à jour un autre dossier.;Possibilité de restreindre l'export pour certaines familles;;;MENU STOCK - Articles - Bouton Outils - Bouton Extraction Articles;;;;N;Ecran;Nouveauté;10866;2020_04_01
16774;STOCK;15/04/2020;Nouveaux automates (041-042) pour exporter/importer la base articles;;;;OK;;;;N;Ecran;Nouveauté;10866;2020_04_01
16733;DIVERS;14/04/2020;Le mise à jour des Tarifs par fichier externe n'est plus réservée qu'à l'administrateur.;Autorisé à tout utilisateur selon paramètres autorisation.;;;PARAMETRES AUTORISATION - Bouton Gestion - Bouton Divers;;;;O;Ecran;Nouveauté;;2020_04_01
16730;CLIENT;10/04/2020;Création Rapide client. Ajout de la case partie commune dans le cas d'un collectif.;;;;OK;;;;N;Ecran;Modification;;2020_04_01
16731;STOCK;10/04/2020;Possibilité de saisir un retour de pièce posée chez un client pour les interventions ayant dèjà mis à jour le stock.;Les pièces seront réintégrées dans le magasin ou le stock voiture.;Soumis à autorisation;;MENU LE STOCK - Article - Bouton Mouvement - Bouton Retour Client;Paramètres Autorisation - Bouton Gestion - Onglet Stock;;;N;Ecran;Nouveauté;;2020_04_01
16732;MAILING;10/04/2020;Possibilité d'envoyer des mailings par Mail;;;;OK;;;;N;Ecran;Nouveauté;;2020_04_01
16728;STOCK;08/04/2020;Possibilité de rechercher les commandes par N° de marché;;;;MENU LE STOCK -  Article - Bouton Mouvement - Bouton Commande;;;;N;Ecran;Nouveauté;;2020_04_01
16729;STOCK;08/04/2020;Possibilité de supprimer les casiers;Réserver ADMINISTRATEUR;;;MENU LE STOCK -  Article - Bouton Outils - Bouton Modifier casier - Bouton Supprimer Casier;;;;N;Ecran;Nouveauté;;2020_04_01
16725;PERSONNEL;06/04/2020;Saisie rapide d'absence personnel. Message d'alerte s'il existe déjà une absence pour la même date et même période.;;;;OK;;;;N;Ecran;Modification;17097;2020_04_01
16726;COLLECTIF;06/04/2020;Possibilité de supprimer les appareils d'un collectif et selon un N° d'ordre appareil.;;;;MENU COLLECTIF - Divers - Divers;;;;N;Ecran;Nouveauté;;2020_04_01
16727;COLLECTIF;06/04/2020;Possibilité de mettre les appareils sous-contrat pour un collectif et  selon un N° d'ordre appareil.;;;;MENU COLLECTIF - Divers - Divers;;;;N;Ecran;Nouveauté;;2020_04_01
16724;FACTURE;03/04/2020;Possibilité d'alerter ou bloquer si la date de réglement est antérieure à la date de facture.;;;;PARAMETRES GENERAUX - Facture - Onglet Divers 1;;;;O;Ecran;Nouveauté;;2020_04_01
16832;COMPTABILITE;02/04/2020;Problème de libellé inexistant lors de l'interface;;;;Corrigé;;;;N;;Correction;;2020_04_01
16834;COMPTABILITE;31/03/2020;Ajout du mail dans l'interface client;;;;OK;;;;N;;Modification;;2020_04_01
16831;COMPTABILITE;30/03/2020;Problème de compte général pour les prélèvements;;;;Corrigé;;;;N;;Correction;;2020_03_15
16720;FACTURE;27/03/2020;Nouveau calcul des aides financières.;La prime ANAH est remplacée par la PRIME RENOV.;La prime RENOV et le CITE sont soumis à des nouvelles conditions de revenus.;;MENU FACTURE - Bouton DIVERS - Bouton Aides Financières;A partir de l'écran Facture-Devis , Bouton Calculatrice Aides Financières dans l'onglet Corps;;;N;Ecran;Modification;;2020_03_20
16721;FACTURE;27/03/2020;Le nouveau crédit d'impôt n'est plus calculé sur un pourcentage.;Nouveau paramètre pour interdire le calcul automatique selon la référence.;;;PARAMETRES GENERAUX - Onglet Divers 4;;;;O;Ecran;Nouveauté;;2020_03_20
16722;STOCK;27/03/2020;Nouveau champ dans la fiche stock pour faire le lien avec la nomenclature des crédits d'impôt.;;;;FICHE ARTICLE - Code Prime;;;;N;Ecran;Nouveauté;;2020_03_20
16723;CLIENT;27/03/2020;Possibilité de ne pas éditer de renouvellement, de création de factures pour les contrats dont le montant est nul.;;;;PARAMETRES GENERAUX - Contrat - Onglet Individuel - Onglet Page 3;;;;O;Ecran;Nouveauté;;2020_03_20
16719;CLIENT;26/03/2020;Accès aux factures, devis à partir de la fiche Client.;Dans l'écran de résultat, nouveau critère pour afficher selon les types (Facture, Devis, Avoir, Intervention) ;;;OK;;;;N;Ecran;Modification;;2020_03_20
16718;CONTRAT;25/03/2020;Edition échéance Contrat avec Texte;Nouvelle variable MOIS PREVISIONNEL pour éditer le mois prévisionnel d'entretien du client.;;;OK;;;;N;Impression;Modification;;2020_03_20
16717;COLLECTIF;19/03/2020;Possibilité de mettre une durée supplémentaire d'entretien;Cette durée sera ajoutée sera ajoutée aux durées d'entretien des appareils de chaque locataire.;Durée entretien locataire = Durées appareil + durée supplémentaire à prévoir  + durée supplémentaire collectif;Durée entretien individuel = Durées appareil + durée supplémentaire à prévoir;FICHE COLLECTIF - Onglet Généralités - Onglet Entretien;FICHE CLIENT - Onglet Intervention;;;N;Ecran;Nouveauté;16085;2020_03_15
16716;INTERVENTION;18/03/2020;Ne pas avoir de message pour certaines absences personnel lors d'une création d'intervention;;;;FICHIERS GENERAUX - Onglet Divers 2 - Motif Absence - Cocher Pas de Message;;;;N;Ecran;Nouveauté;;2020_03_15
16714;STOCK;12/03/2020;Possibilité de bloquer ou d'alerter le passage en inactif d'une référence avec qté en stock.;;;;PARAMETRES GENERAUX - Stock - Onglet Page 4;;;;O;Ecran;Modification;16277;2020_03_01
16715;COLLECTIF;12/03/2020;Modifier les Tiers pour un Marché;;;;MENU LES COLLECTIFS - Divers - Divers - Bouton Modifier Tiers selon Marché;;;;N;Ecran;Nouveauté;16627;2020_03_01
16713;FACTURE;11/03/2020;Rendre le niveau obligatoire dans un devis;;;;PARAMETRES GENERAUX - Facture - Onglet Devis;;;;O;Ecran;Modification;16843;2020_03_01
16710;APPAREIL;07/03/2020;Le visuel appareil photo apparait en vert si des photos ont été déposées.;;;;OK;;;;N;Ecran;Modification;;2020_03_01
16711;PERSONNEL;07/03/2020;Le bouton document apparait avec un visuel vert si des documents ont été déposés.;;;;OK;;;;N;Ecran;Modification;;2020_03_01
16712;COLLECTIF;07/03/2020;Le bouton document apparait avec un visuel vert si des documents ont été déposés.;;;;OK;;;;N;Ecran;Modification;;2020_03_01
16708;FACTURE;06/03/2020;Possibilité que les bons collectifs ne contiennent pas de montants facturés;;;;PARAMETRES GENERAUX - Facture - Onglet Divers 1 - Cocher Montant facturé facultatif;;;;O;Ecran;Modification;;2020_03_01
16709;CLIENT;06/03/2020;Recherche Client. Possibilité de ne pas ouvrir automatiquement la fiche client lorsque le résultat de la recherche correspond ;à un seul client.;;;PARAMETRES GENERAUX - Divers - Onglet Page 3 - Cocher Ne pas ouvrir automatiquement la fiche Client;;;;O;Ecran;Modification;;2020_03_01
16707;STOCK;05/03/2020;Les conditionnements d'achat et vente pour les articles sont désormais avec décimales.;;;;OK;;;;N;Ecran;Modification;;2020_03_01
16703;DIVERS;04/03/2020;Possibilité d'avoir des tarifs réservés;Ces tarifs sont utilisables selon autorisation utilisateur;;;FICHE TARIF - Case à cocher;;;;N;Ecran;Nouveauté;;2020_03_01
16704;DIVERS;04/03/2020;Paramètre d'autorisation d'utiliser un tarif réservé (facture, devis..);;;;PARAMETRES AUTORISATION - Onglet Facture;;;;O;Ecran;Nouveauté;;2020_03_01
16705;CLIENT;04/03/2020;Possibilité d'interdire l'envoi de proposition à un client;;;;FICHE CLIENT - Onglet Contrat - Onglet Individuel - Onglet Généralités 2;;;;N;Ecran;Nouveauté;;2020_03_01
16698;STOCK;03/03/2020;Possibilité d'avoir un message d'alerte si le stock mini est atteint lors de l'ouverture de la fiche article;;;;PARAMETRES GENERAUX - Stock - Onglet Page 3;;;;O;Ecran;Nouveauté;;2020_03_01
16699;STOCK;03/03/2020;Dans la fiche article, un visuel apparait si le stock mini est atteint.;;;;MENU LE STOCK - Article - Fiche article;;;;N;Ecran;Nouveauté;;2020_03_01
16700;STOCK;03/03/2020;Possibilité de rechercher les références dont le stock mini est atteint.;;;;MENU LE STOCK - Article;;;;N;Ecran;Nouveauté;;2020_03_01
16701;FACTURE;03/03/2020;L'état des impayés de tenait pas compte des primes (CEE....);;;;Corrigé;MENU LA COMPTABILITE - Etat Impayés;;;N;;Correction;;2020_03_01
16702;FACTURE;03/03/2020;Les modes de financement  disparaissaient lors d'une modification de devis.;;;;Corrigé;;;;N;;Correction;;2020_03_01
16706;PERSONNEL;01/03/2020;Pour les appareils de mesures détenus par un technicien, possibilité de préciser son emploi.;PAC pour les mesures liées aux PAC, Attestation pour les VE (CO2...);;;FICHE PERSONNEL - Onglet Voiture - Onglet Appareil de Mesures;;;;N;Ecran;Modification;;2020_03_01
16695;FACTURE;28/02/2020;Interdire Création/Modification/Suppression des devis type;;;;PARAMETRES AUTORISATION - Bouton Gestion - Onglet Facture - Cocher Interdire Gestion Devis Type;;;;O;Ecran;Nouveauté;;2020_02_03
16696;CLIENT;28/02/2020;Ne pas faire apparaitre le message Non conformité à l'ouverture de la fiche client;;;;PARAMETRES GENERAUX - Divers - Onglet Page 1;;;;O;Ecran;Nouveauté;;2020_02_03
16697;FACTURE;28/02/2020;Ne pas mettre automatiquement F en création de  Facture-Devis....;;;;PARAMETRES GENERAUX - Facture - Onglet Divers;;;;O;Ecran;Nouveauté;;2020_02_03
16694;STOCK;26/02/2020;Les calculs de prix de vente se font désormais sur 4 tranches de prix d'achat au lieu de 3;;;;PARAMETRES GENERAUX - Stock - Page 2;;;;N;Ecran;Modification;;2020_02_03
16693;DIVERS;25/02/2020;Possibilité de voir le dernier traitement lancé par chaque utilisateur;;;;MENU OUTILS - Activité Utilisateurs - Bouton Dernier Traitement;;;;N;Ecran;Nouveauté;;2020_02_03
16687;MAILING;21/02/2020;Ajout du critère Type de logement pour les mailing;;;;OK;;;;N;Ecran;Modification;;2020_02_03
16688;INTERVENTION;21/02/2020;En saisie de chantier, pouvoir associer un devis.;;;;MENU INTERVENTION - Appel - Bouton Saisie - Bouton Saisie Chantier;;;;N;Ecran;Modification;;2020_02_03
16689;STOCK;21/02/2020;Possibilité de mettre un n° de marché dans une commande.;;;;OK;;;;N;Ecran;Modification;;2020_02_03
16690;COLLECTIF;21/02/2020;Situation intervention. Ajout de l'édition cumulée par batiment.;;;;OK;;;;N;Ecran+Impression;Nouveauté;;2020_02_03
16691;STOCK;21/02/2020;Edition des manques voiture selon voiture type.;Ajout des quantité de l'agence rattachée à chaque technicien.;;;MENU STOCK - Article - Bouton Stock voiture -  Bouton Voiture Type - Bouton Les Manques Techniciens;;;;N;Ecran+Impression;Modification;;2020_02_03
16692;COLLECTIF;21/02/2020;Situation intervention. Ajout du critère Batiment.;;;;OK;;;;N;Ecran+Impression;Nouveauté;;2020_02_03
16686;FACTURE;19/02/2020;Relance impayée quelques factures.;Possibilité de prendre également les factures non échues.;;;OK;;;;N;;Modification;;2020_02_02
16682;STOCK;17/02/2020;Commande Articles.;Possibilité que le montant de l'Eco Taxe ne soit pas prise en compte dans le montant total commandé;;;PARAMETRES  GENERAUX - Stock - Onglet Commande - Onglet Commande 1;;;;O;;Nouveauté;;2020_02_02
16683;STOCK;17/02/2020;Commande Articles.;Possibilité que le montant de l'Eco Taxe ne soit pas prise en compte dans le montant total commandé;;;OK;;;;N;;Nouveauté;;2020_02_02
16684;PERSONNEL;17/02/2020;Fiche personnel.;Les sorties pièce de la voiture peuvent être attibuées à un autre technicien avec une date limite.;;;FICHE PERSONNEL;;;;N;;Nouveauté;;2020_02_02
16685;PERSONNEL;17/02/2020;Fiche personnel.;Possibilité de voir les modifications de la fiche personnel (nom, mobilité, type, équipe, agence, inactif..);Visuel M sous fond rouge;;FICHE PERSONNEL;;;;N;;Nouveauté;;2020_02_02
16675;STOCK;12/02/2020;Commande avec affectation voiture.;Possibilité de bloquer ou d'alerter si pas de voiture renseignée.;;;PARAMETRES GENERAUX - Stock - Onglet Commande - Onglet Commande 2;;;;O;;Nouveauté;;2020_02_01
16676;CLIENT;12/02/2020;Réclamation client.;N° de réclamation automatique.;;;OK;;;;N;;Nouveauté;;2020_02_01
16677;COMPTABILITE;12/02/2020;Possibilité lors du lien de lancer une mise à jour automatique.;;;;PARAMETRES COMPTABILITE - Onglet Divers 1;;;;O;;Nouveauté;;2020_02_01
16678;FACTURE;12/02/2020;Mise à jour des factures par automate.;Possibilité de ne sélectionner les factures que sur les N derniers jours.;;;PARAMETRES GENERAUX - Divers - Onglet Automatismes 1;;;;O;;Nouveauté;;2020_02_01
16679;INTERVENTION;12/02/2020;Ajout d'une case à cocher pour préciser si le BI papier a été redonné au bureau.;Critère de recherche sur les BI redonnés ou non.;;;OK;;;;N;;Nouveauté;;2020_02_01
16680;CONTRAT;12/02/2020;Nouveau champ Marque dans l'agence pour les SMS.;La Marque sera prise si renseignée, sinon Nom Agence si renseigné, sinon Raison Sociale;Sous condition que Prendre nom agence soit coché dans les paramètres - onglet divers - onglet SMS;;PARAMETRES -  Agences;;;;N;;Nouveauté;;2020_02_01
16681;STOCK;12/02/2020;Catalogue EDILKAMIN - 2020;;;;OK;;;;N;;Nouveauté;;2020_02_01
16673;STOCK;11/02/2020;Catalogue AUER - 2020;;;;OK;;;;N;;Nouveauté;;2020_02_01
16674;STOCK;11/02/2020;Catalogue RIELLO - 2020;;;;OK;;;;N;;Nouveauté;;2020_02_01
16672;CLIENT;06/02/2020;Nouveau visuel dans la fiche client. (Triangle rouge avec C au centre);Permet de visualiser les modifications des dates d'entretien et/ou renouvellement pas le biais des mises à jour de facture.;;;OK;;;;N;;Nouveauté;;2020_01_01
16667;STOCK;05/02/2020;Catalogue CHAFFOTEAUX - 2020;;;;OK;;;;N;;Nouveauté;;2020_01_01
16668;STOCK;05/02/2020;Catalogue ELM LEBLANC - 2020;;;;OK;;;;N;;Nouveauté;;2020_01_01
16670;DIVERS;05/02/2020;Nouvel Automate (038) pour l'archivage des attestations TVA provenant de la mobilité ;;;;OK;;;;O;;Nouveauté;;2020_02_01
16671;STOCK;05/02/2020;Catalogue VIESSMANN - 2020;;;;OK;;;;N;;Nouveauté;;2020_01_01
16669;COMPTABILITE;04/02/2020;Lien comptable. Possibilité d'intégrer les lignes Client dont le montant est nul;;;;PARAMETRES COMPTABILITE - Onglet Généralités - Onglet Divers 2;;;;O;;Nouveauté;;2020_02_01
16666;STOCK;03/02/2020;Catalogue DE DIETRICH - 2020;;;;OK;;;;N;;Nouveauté;;2020_01_01
16664;STOCK;29/01/2020;BON INTERNE. Possibilité d'affecter un préfixe sur les N° de bon interne.;;;;PARAMETRES - Compteurs;;;;N;;Modification;;2020_01_01
16665;STOCK;29/01/2020;BON INTERNE. Possibilité de ne pas avoir le nom du dossier cible dans le N° de dossier.;;;;PARAMETRES GENERAUX - Stock - Onglet Bon Interne;;;;N;;Modification;;2020_01_01
16663;STOCK;28/01/2020;Catalogue ATLANTIC - 2020;;;;OK;;;;N;;Nouveauté;;2020_01_01
16661;CLIENT;22/01/2020;Passer en Hors-contrat les clients interdits et transférés;Réserver Administrateur;;;MENU LES CLIENTS - Divers - Contrôles Clients - Onglet Page 3 - Bouton Passer en Hors Contrat les Interdits Transférés;;;;N;;Nouveauté;;2020_01_01
16662;INTERVENTION;22/01/2020;Annuler les interventions pour les clients interdits et transférés;Réserver Administrateur;;;MENU LES INTERVENTIONS - Appel - Bouton Divers - Bouton Annulation pour Clients Interdits et Transférés;;;;N;;Nouveauté;;2020_01_01
16656;COMPTABILITE;21/01/2020;Dans l'écran des remises bancaires il est possible de classer par montant.;;;;OK;;;;N;;Modification;16305;2020_01_01
16660;STOCK;21/01/2020;Passer les désignations en minuscule.;;;;MENU LE STOCK - ARTICLE - Bouton Outils - Bouton Mettre Désignations en Minuscule;;;;N;;Nouveauté;15583;2020_01_01
16653;FACTURE;20/01/2020;Création avoir à partir de la fiche client.;Le système ne tenait pas compte des droits de l'utilisateur;;;FICHE CLIENT - Bouton Facture - Bouton Création Avoir;;;;N;;Correction;16304;2020_01_01
16654;FACTURE;20/01/2020;En création rapide de retour, la date du tuyau n'était réinitialisée à chaque saisie.;;;;OK;;;;N;;Correction;16334;2020_01_01
16655;CLIENT;20/01/2020;Affichage des réclamations à l'ouverture.;Ajouter l'utilisateur attribué à la réclamation.;Surligner les réclamations sans clôture définitive selon un dépassement selon date de création (paramètres);;PARAMETRES GENERAUX - DIVERS - Onglet Automatismes;;;;O;;Modification;16334;2020_01_01
16657;CLIENT;20/01/2020;Possibilité d'affecter un numéro dans les réclamations.;Ce numéro peut être relié aux actions téléphoniques.;;;OK;;;;N;;Modification;16325;2020_01_01
16658;INTERVENTION;20/01/2020;Nouveaux paramètres pour les SMS;Ne prendre que les 3 premières lettres du jour (VEN au lieu de VENDREDI);Tranche horaire en minuscule (avant au lieu de Avant);Format heure (14h00 au lieu de 14,00 h);PARAMETRES GENERAUX - SMS;;;;O;;Modification;16367;2020_01_01
16659;FACTURE;20/01/2020;Nouveau paramètre d'autorisation pour bloquer la case Plus d'impayé dans les factures;;;;PARAMETRES AUTORISATIONS - Onglet Facture;;;;O;;Nouveauté;15583;2020_01_01
16649;FACTURE;10/01/2020;Les modifications de statut devis et dates (acceptation, refus..) sont stockées dans la table MODIFACTU;;;;OK;;;;N;;Modification;;2020_01_01
16650;STOCK;10/01/2020;Possibilité de voir la répartition des stocks selon dossiers et agences.;La répartition par agence n'est possible que dans le cas ou il y une gestion de magasin agence dans un même dossier.;;;MENU LE STOCK - Article - Bouton Stock Dossier;;;;N;;Nouveauté;;2020_01_01
