N fonctionnalité;THEME;Date Fait;Demande 1;Demande 2;Demande 3;Demande 4;Résultat 1;Résultat 2;Résultat 3;Résultat 4;Paramètre Modifié;Ecran/Impression;Type;Ticket;Version
11309;PLANNING AUTO;13/10/2010;Dans l'écran de résultat, possibilité de n'afficher que les anomalies techniciens ou période;;;;Ok;;;;;;Modification;;2010
11304;INDICATEUR;08/10/2010;Enlever indicateur VE (édition f);;;;Ok;;;;;;Modification;;2010
11308;STOCK;08/10/2010;Erreur édition fax destinataire sur demande prix;;;;Ok;;;;;;Modification;;2010
11273;FACTURE;07/10/2010;Interdire la sortie a charge pour des clients en garantie simple. selon droit utilisateur selon type de client;Selon genre appareil;;;Paramètres généraux - onglet facture - onglet divers3 - cocher interdire sortie à charge pour contrat indviduel simple;Cocher les genres appareil - cocher les type de factures dans compteur;;;O;;Modification;;2010
11301;INTERVENTION;07/10/2010;"""Si entretien NON fait reprendre automatiquement en observation """"entretien a faire""""""";;;;Paramètres généraux - onglet BI - onglet saisie - cocher observation automatique VE à faire;;;;O;;Modification;;2010
11303;INDICATEUR;07/10/2010;Pra ajouter une partie hors chaudiere murale + partie totale;Option p idem;;;Ok;;;;;;Modification;;2010
11275;STOCK;07/10/2010;Editer les sorties a charge selon garantie contractuelle;;;;Menu stock - articles - barre outils - imprimer - incoherences;;;;;;Modification;;2010
11276;STOCK;07/10/2010;Editer les sorties sous garanties pour des appareils hors garantis;;;;Menu stock - articles - barre outils - imprimer - incoherences;;;;;;Modification;;2010
11302;PLANNING HEBDO;06/10/2010;En prise appel. afficher une alerte si devis en cours;Doit tenir compte du delai de visualisation  devis (paramètres généraux-onglet facture-onglet devis);;;"""Paramètres généraux - onglet BI - onglet saisie - cocher """"alerte devis en cours""""""";;;;O;;Modification;;2010
11305;CLIENT;06/10/2010;Possibilité de création prévision pour client divers;;;;Ok;;;;;;Modification;;2010
11306;INTERVENTION;06/10/2010;Interdire completement la visu ancien planning;;;;"""Paramètres généraux - onglet BI - onglet saisie - cocher """"interdire ancien planning""""""";;;;O;;Modification;;2010
11307;FACTURE;05/10/2010;Production retour techniciens. ajouter les durées des retours;;;;Ok;;;;;;Modification;;2010
11281;CONTRAT;02/10/2010;Ajouter sur une ligne prélèvement une case pour NON passage en comptabilité;Cette case est soumise a autorisation;;;Ok;;;;;;Modification;;2010
11298;FACTURE;01/10/2010;Si 2 taux de TVA.    rester dans le corps sur le taux de TVA;;;;Paramètres généraux - onglet facture - onglet divers 1 - cocher saisir le code TVA dans le corps;;;;O;;Modification;;2010
11299;INTERVENTION;01/10/2010;Alerte sms. delais différents selon le jour siNON prend par défaut le delai général;;;;PARAMETRES GENERAUX - SMS;;;;O;;Modification;;2010
11300;FACTURE;01/10/2010;Interdire des codes retour selon document (devis, facture, avoir.......);;;;Fichiers généraux - onglet ir - onglet retour - bouton gérer;;;;;;Modification;;2010
11296;CONTRAT;30/09/2010;En prestation contrat individuel le type de contrat doit être les 4 premiers caractères du tarif;;;;Paramètres généraux - onglet contrat - onglet individuel - renseigner type contrat;;;;O;;Modification;;2010
11297;CLIENT;30/09/2010;Pour client collectif le champ type contrat doit être la garantie la plus importante des lignes contrat;;;;Ok;;;;;;Modification;;2010
11268;FACTURE;29/09/2010;En saisie retour absent entretien création automatique intervention si 2eme date prévue suite au planning;;;;Paramètres généraux - onglet contrat - onglet général - cocher proposer une 2éme date programmation;;;;O;;Modification;;2010
11267;PLANNING AUTO;28/09/2010;Prevoir 2eme date prévue pour entretien collectif avec nombre de jours différents;;;;Paramètres généraux - Contrat - onglet Planning - cocher proposer une 2éme date programmation;;;;O;;Modification;;2010
11294;APPAREIL;28/09/2010;Editer des fiches entretien pac vierges;;;;Menu divers;;;;;;Modification;;2010
11295;DIVERS;28/09/2010;Création d'un utilisateur automate pour éviter certains traitements automatiques;;;;Ok;;;;;;Modification;;2010
11292;PERSONNEL;27/09/2010;Autorisation pour saisie rapide absence;Autorisation gestion personnel (interdiction complète);;;Ok;;;;;;Modification;;2010
11291;FACTURE;24/09/2010;Etat récapitulatif des ventes et règlement d'un client (simplifiée);;;;Factures - barre outils -édition-liste-cocher synthèse client;;;;;;Modification;;2010
11286;STOCK;24/09/2010;Stock agence NON mouvementée. ne pas alerter sur fiche simplement créee;;;;Ok;;;;;;Modification;;2010
11250;COLLECTIF;21/09/2010;Ajouter dans les lignes facturation une ligne observation (corps);;;;Ok;;;;;;Modification;;2010
11257;COLLECTIF;21/09/2010;Provision cca. possibilité de saisir la date de fin;;;;Ok;;;;;;Modification;;2010
11261;COMPTABILITE;21/09/2010;Section analytique specifique comptoir (ajouter agence et paramètres compta);;;;Ok;;;;;;Modification;;2010
11278;FACTURE;20/09/2010;Interdire un dépannage contrat pour un client hors contrat;Interdire un dépannage facturable pour un client contrat;;;Fichiers généraux - onglet ir - onglet retour - gérer;Cocher pour chaque les interdictions possibles;;;;;Modification;;2010
11290;INTERVENTION;20/09/2010;Editer le nom du technicien selon paramètre;;;;Paramètres généraux - onglet BI - onglet édition - cocher éditer le nom du technicien;;;;O;;Modification;;2010
11289;DIVERS;19/09/2010;Possibilité de restructurer  des tables sélectionnées selon un utilisateur;;;;Ok;;;;;;Modification;;2010
11287;STOCK;17/09/2010;Integration du catalogue Dupont;;;;Ok;;;;;;Modification;;2010
11288;FICHIERS GENERAUX;17/09/2010;Possibilité d'augmenter les tarifs contrat en une seule fois;;;;Ok;;;;;;Modification;;2010
11285;STOCK;16/09/2010;Possibilité de voir les factures Fournisseur à partir de sa fiche;;;;Bouton facture dans la fiche Fournisseur;;;;;;Modification;;2010
11277;CONTRAT;15/09/2010;Alerte ve. ajouter le nombre d'absences, d'interventions impossibles et la date de programmation;;;;Ok;;;;;;Modification;;2010
11284;FACTURE;15/09/2010;Possibilité de dupliquer un devis avec changement de client et de payeur;;;;Ok;;;;;;Modification;;2010
11253;STOCK;12/09/2010;Histo mouvement. ajouter en édition et export le n° contrat + section analytique existante;;;;Stock - article - barre outils - historique - consultation édition;;;;;;Modification;;2010
11283;CLIENT;07/09/2010;Paramètrer le code vente de pièce afin de ne pas avoir 1 par défaut;;;;Paramètres généraux - onglert stock - onglet page 2;Renseigner code prix client par défaut;;;O;;Modification;;2010
11282;INTERVENTION;06/09/2010;Modification du cahier appel si l'origine intervention vient du planning auto;;;;Ok;;;;;;Modification;;2010
11247;PLANNING HEBDO;03/09/2010;Afficher la date et tech prochaine intervention;;;;Ok;;;;;;Modification;;2010
11245;APPAREIL;20/08/2010;Paramètres pour un tableau de rendement libre;;;;Paramètres généraux - onglet divers - onglet page 3 - cocher rendement année libre;;;;O;;Modification;;2010
11272;FACTURE;20/08/2010;Annulation plusieurs factures avec multi critères : client, Tiers, collectif, marché;;;;Ok;;;;;;Modification;;2010
11271;COLLECTIF;19/08/2010;Situation intervention - ajouter critère sélection - choix sur date intervention ou contrat;Edition détaillée ou cumulée;;;Ok;;;;;;Modification;;2010
11266;APPAREIL;16/08/2010;Editer les nomenclatures NON utilisées;;;;Menu fichiers - nomenclature - bouton gérer - bouton imprimer;;;;;;Modification;;2010
11256;COLLECTIF;13/08/2010;Edition recap des factures de contrat d'un collectif;;;;Menu collectif - menu édition - menu liste - bouton facturation - bouton récapitulatif;;;;;;Modification;;2010
11252;COMPTABILITE;12/08/2010;Ajouter paramètre section analytique pour contrat individuel;;;;Ok;;;;;;Modification;;2010
11264;INSTALLATEUR;12/08/2010;Possibilité de rendre inactif un installateur pour ne plus facturer;;;;Ok;;;;;;Modification;;2010
11265;INSTALLATEUR;12/08/2010;Afficher dans l'écran installateur la liste de ses factures;;;;Ok;;;;;;Modification;;2010
11251;TIERS;11/08/2010;Liste recap entretien locataires avec ou sans montant contrat;;;;Ok;;;;;;Modification;;2010
11258;COMPTABILITE;11/08/2010;Tva encaissée. critère sélection (comptoir, hors comptoir);;;;Ok;;;;;;Modification;;2010
11259;COMPTABILITE;11/08/2010;Compte de TVA différent pour vente comptoir;;;;Paramètres comptabilité - onglet comptes;;;;O;;Modification;;2010
11260;COMPTABILITE;11/08/2010;Compte collectif différent selon certains Tiers;;;;Fiche du Tiers - onglet divers - cocher comptabilité groupe - renseigner le collectif;;;;;;Modification;;2010
11262;CLIENT;11/08/2010;Paramètres pour ne pas tenir compte du préfixe client lors d'une recherche;;;;Paramètres compteur;;;;O;;Modification;;2010
11254;CONTRAT;10/08/2010;Ajouter contrôle facturation contrat individuel (montant, code tarif, n° facture);;;;Ok;;;;;;Modification;;2010
11255;FACTURE;10/08/2010;En cas de compteur agence. vérifier la conversion de devis en facture;Prendrait le compteur général;;;Pas de pb;;;;;;Modification;;2010
11248;PARAMETRES;22/07/2010;Paramètres comptabilité. ajouter folio fixe;;;;Ok;;;;;;Modification;;2010
11232;CLIENT;08/07/2010;A partir de la fiche d'un client visualiser les appels avec classement par date;;;;Paramètres généraux - onglet BI - onglet saisie - cocher ou NON la case;               ne pas classer les appels en fiche client;;;O;;Modification;;2010
11244;FACTURE;08/07/2010;Editer pour les interventions gratuites les 5 lignes observations histo;;;;Pour les état sa-lfac1 et sa-lfac2;;;;;;Modification;;2010
11243;PLANNING HEBDO;08/07/2010;Bouton pour acceder directement au planning graphique;;;;Ok;;;;;;Modification;;2010
11239;PARAMETRES;06/07/2010;Paramètres généraux - onglet cout;Prime CA => contrat sur % et NON fixe;;;Ok;;;;;;Modification;;2010
11241;PLANNING HEBDO;06/07/2010;Possibilité de modifier rapidement les techniciens intervention;;;;Ok;;;;;;Modification;;2010
11240;CONTRAT;05/07/2010;Editer les renouvellements de contrat que pour certains types de contrat;;;;Dans les types contrat cocher ceux ne faisant pas l'objet d'édition d'avis de renouvellement;Ne fonctionne que pour sélection échéance cochée(paramètres édition - divers);;;;;Modification;;2010
11242;FACTURE;05/07/2010;Facture Fournisseur et installateur avec TVA majorée;;;;Ok;;;;;;Modification;;2010
11235;FACTURE;28/06/2010;Edition facture et devis.;Ne pas éditer le n° facture/devis en gros (en petit en haut à droite) à partir de la 2eme page;Editer référence au bon niveau;;Ok;;;;;;Modification;;2010
11236;PARAMETRES;28/06/2010;Possibilité d'éditer l'acompte devis arrondi;;;;Ok;;;;;;Modification;;2010
11237;FACTURE;28/06/2010;Editer la remise globale en pied de facture/devis;;;;Ok;;;;;;Modification;;2010
11238;APPAREIL;25/06/2010;Pb installateur dans fiche appareil;;;;Ok;;;;;;Modification;;2010
11231;FACTURE;06/06/2010;Alerter dans le corps de facture si la longueur est trop importante pour l'édition;;;;Paramètres édition - onglet facture;Saisir longueur pour facture et devis;;;O;;Modification;;2010
11234;COLLECTIF;01/06/2010;A partir de la fiche collectif. en mise à jour locataire ajouter l'adresse complete;;;;Ok;;;;;;Modification;;2010
11233;COMPTABILITE;29/05/2010;Possibilité de mettre un règlement en attente;Dans ce cas : pas de remise bancaire, pas de bordereau, pas d'interface comptable;;;Ok;;;;;;Modification;;2010
11224;CLIENT;03/05/2010;En courrier NON conformité éditer toutes les lignes de textes d'anomalies et actions;;;;Ok;;;;;;Modification;;2010
11221;PLANNING HEBDO;02/05/2010;Possibilité de classer les clients (nom,rue,ville....);;;;Impossible;;;;;;Modification;;2010
11229;COMPTABILITE;27/04/2010;Compte collectif client différent selon agence;;;;Ok;;;;;;Modification;;2010
11225;COLLECTIF;27/04/2010;Ajouter dans la fiche collectif le nombre d'heures vendues;;;;Ok;;;;;;Modification;;2010
11227;COMPTABILITE;27/04/2010;Champ analytique par garantie contrat (simple/totale) et par agence;;;;Ok;;;;;;Modification;;2010
11228;COLLECTIF;27/04/2010;Ajouter dans fiche collectif champ analytique;;;;Ok;;;;;;Modification;;2010
11222;APPAREIL;14/04/2010;Possibilité d'integrer le bruleur dans l'appareil ou de créer une autre fiche appareil;;;;Paarmetres généraux - onglet divers - onglet page 1;"""Cocher la case """"brûleur intégré dans appareil""""""";;;;;Modification;;2010
11175;COLLECTIF;10/04/2010;Facture collectif diffrencie par type de contrat (p2/p3);;;;Ok;;;;;;Modification;;2010
11211;DIVERS;08/04/2010;Test sur les premiers chiffres du téléphones selon le département;Test sur l'indicatif selon le pays;;;Ok;;;;;;Modification;;2010
11218;DIVERS;07/04/2010;Ne pas afficher les prévisions selon utilisateur;;;;Paramètres autorisation - bouton gestion - onglet divers;;;;O;;Modification;;2010
11212;CONTRAT;06/04/2010;Ajouter dans liste renouvellement la ligne observation client;;;;Paramètres généraux - onglet contrat - onglet individuel - onglet page 1;"""Cocher """"observation client sur liste échéance""""""";;;O;;Modification;;2010
11205;CONTRAT;02/04/2010;Liste VE programmées. ajouter critère agence;;;;Ok;;;;;;Modification;;2010
11209;PLANNING HEBDO;02/04/2010;En prise d'appel. alerte si le client a une intervention passée NON retournée.;;;;Paramètres généraux - onglet BI - onglet saisie;Saisir le nombre de jours anterieurs pour l'alerte;;;O;;Modification;;2010
11210;PLANNING HEBDO;02/04/2010;Afficher un icone si le client a un Email;;;;Ok;;;;;;Modification;;2010
11207;PRELEVEMENT;31/03/2010;Ajouter un paramètre d'autorisation pour supprimer un prélèvement;;;;Paramètres autorisation - Onglet Prélèvement;;;;O;;Modification;;2010
11208;PRELEVEMENT;31/03/2010;En emission de prélèvement vérifier le nombre total pour les éditions détaillées et cumulées;;;;Ok;;;;;;Modification;;2010
11206;INTERVENTION;29/03/2010;Possibilité de ne pas envoyer d'alerte sms aux clients collectifs;;;;PARAMETRES GENERAUX - SMS;;;;O;;Modification;;2010
11204;CONTROLE OBLIGATOIRE;17/03/2010;Pour édition en nombre des attestations ajouter critère de date, de type clientele, de collectif;;;;Ok;;;;;;Modification;;2010
11199;STOCK;17/03/2010;Dans l'écran de commande affichage de l'état des stocks des références;;;;Ok;;;;;;Modification;;2010
11201;CLIENT;16/03/2010;Possibilité d'interdire la saisie de plusieurs chiffres identiques dans un n° tél (ex 0000);;;;Paramètres généraux - onglet divers - onglet page 2;;;;O;;Modification;;2010
11200;CLIENT;16/03/2010;Editer ou supprimer  les tél NON conformes;;;;Menu les clients - menu divers - menu contrôle client - bouton problème téléphone;;;;;;Modification;;2010
11202;FACTURE;16/03/2010;Seuil montant devis selon Tiers avec alerte lors de la création devis;;;;Dans onglet divers de la fiche Tiers;;;;;;Modification;;2010
11203;CONTROLE OBLIGATOIRE;16/03/2010;Pour la saisie retour cocher par défaut en attent d'envoi;;;;Paramètres généraux - onglet facture - onglet divers 5;;;;O;;Modification;;2010
11198;INTERVENTION;15/03/2010;Pour les alertes sms, possibilité en manuel de choisir la date;;;;PARAMETRES GENERAUX - SMS;;;;O;;Modification;;2010
11195;STOCK;10/03/2010;Ajouter une case à cocher appareil dans les familles stock;;;;Ok;;;;;;Modification;;2010
11197;APPAREIL;10/03/2010;Editer la liste des appareils avec leur rendement ou comportant une anomalie rendement;Possibilitér de filtrer selon une date d'intervention;;;Les clients - appareils - bouton rendement;;;;;;Modification;;2010
11192;INDICATEUR;08/03/2010;Ajouter dans les taux de retour(g) tous les genres appareils et famille enr;;;;Ok;;;;;;Modification;;2010
11193;CLIENT;05/03/2010;Outils pour affecter l'origine sur les clients;;;;Menu les clients - menu divers - menu contrôle client - bouton affecter origine;Autoriser administrateur;;;;;Modification;;2010
11194;FACTURE;05/03/2010;Outils pour affecter un domaine activité;;;;Menu facture - barre outils - divers - affecter activité;Autoriser administrateur;;;;;Modification;;2010
11196;TIERS;05/03/2010;Pour la bascule de Tiers en installateur ajouter la possibilité de critère sue le type de clientele;;;;Ok;;;;;;Modification;;2010
11191;INDICATEUR;04/03/2010;Ajouter code retour 1 dans export ratio contrat;;;;Ok;;;;;;Modification;;2010
11190;CONTRAT;03/03/2010;Liste des VE NON faites sur histo contrat individuel;;;;Menu contrat - statistiques - bouton entretien - entretiens NON faits;;;;;;Modification;;2010
11189;PARAMETRES;01/03/2010;N° attestation capacite pac;;;;Paramètres généraux - onglet raison sociale;;;;O;;Modification;;2010
11188;CONTROLE OBLIGATOIRE;26/02/2010;Possibilité dans le tableau des rendements d'obtenir des calculs de rendements, nox ou cov selon;Type de chaudiere, énergie, puissance et année;;;Menu fichiers - nomenclature - bouton gérer - bouton rendement;;;;;;Modification;;2010
11183;CONTROLE OBLIGATOIRE;25/02/2010;Possibilité de saisir des rendements de référence selon l'énergie;;;;Menu paramètres généraux - onglet divers - onglet page 3;;;;O;;Modification;;2010
11180;PLANNING HEBDO;23/02/2010;Pour client interdit avec blocage possibilité de voir le motif de l'interdiction et acceder a la fiche client;;;;Ok;;;;;;Modification;;2010
11173;COLLECTIF;23/02/2010;Ajouter dans l'export synthèse parc cumulée le secteur et type appareil;;;;Ok;;;;;;Modification;;2010
11182;FICHIERS GENERAUX;21/02/2010;Editer la correspondance pour la liste activités;;;;Ok;;;;;;Modification;;2010
11179;STOCK;20/02/2010;En recherche article ajouter le critère inactif;;;;Ok;;;;;;Modification;;2010
11186;APPAREIL;19/02/2010;Visualiser les rendements dans la fiche appareil;;;;Ok;;;;;;Modification;;2010
11187;APPAREIL;19/02/2010;Editer la liste des appareils avec leur rendement contenant les anomalies (pas de rendement);;;;Menu les clients - appareils - bouton rendement;;;;;;Modification;;2010
11181;CONTRAT;19/02/2010;En liste de renouvellement contrat édition en fin de page des clients avec interdiction intervention;;;;Ok;;;;;;Modification;;2010
11178;FACTURE;12/02/2010;Pour une facture contrat possibilité d'interdire de facturer autre que des tarifs contrat;;;;Paramètres généraux - onglet facture - onglet contrat;"""Cocher """"ne contient que des tarifs contrat""""""";;;O;;Modification;;2010
11169;CLIENT;06/02/2010;Ajouter dans contact les alertes sms;;;;Ok;;;;;;Modification;;2010
11170;CLIENT;06/02/2010;Test homonymie sur contact;;;;Ok;;;;;;Modification;;2010
11168;INTERVENTION;04/02/2010;Paramètre pour autoriser l'accès a l'ancien planning technicien;;;;Menu paramètres - autorisations - bouton gestion - onglet intervention;"""Cocher """" accès ancien planning technicien""""""";;;O;;Modification;;2010
11172;FACTURE;04/02/2010;Ne pas transformer des bons collectifs en facture tant que la mise à jour n'est pas faite;;;;Ok;;;;;;Modification;;2010
11167;STOCK;01/02/2010;Possibilité de rendre obligatoire dans la fiche article la saisie du genre selon famille;;;;Menu fichiers généraux - onglet divers 1 - onglet fournitures - onglet famille;;;;;;Modification;;2010
11164;COLLECTIF;29/01/2010;Outils pour affecter une formule de révision aux collectif d'un marché;;;;Menu les collectifs - divers - divers;;;;;;Modification;;2010
11165;COLLECTIF;29/01/2010;En révision avec taux possibilité de ne pas effacer les formules existantes du collectif;;;;Paramètres généraux - onglet contrat onglet collectif -;"""Cocher """"ne pas effacer formule révision si taux utilisé""""""";;;O;;Modification;;2010
11162;FACTURE;29/01/2010;Possibilité d'éditer une facture ou avoir a titre d'essai afin de ne pas bloquer les factures en modification;Dans ce cas la ville et code postal du destinataire ne sera pas editée;;;Menu paramètres édition - onglet facture;"""Cocher """"autoriser l'essai édition pour facture et avoir""""""";;;O;;Modification;;2010
11132;STOCK;28/01/2010;Pour changement ou réaffectation de références création d'un historique;A visualiser ou éditer;;;Menu le stock - articles - barre outils divers - histo changement;;;;;;Modification;;2009
11138;CLIENT;28/01/2010;Suppression dans la fiche client du tarif N-1 et n-2;Pour consulter les tarifs précédents cliquer dans le bouton historique de l'onglet contrat;;;Ok;;;;;;Modification;;2010
11116;CLIENT;28/01/2010;Ajout d'une date butoir de remise contrat sur la fiche client;;;;Ok;;;;;;Modification;;2009
11160;DIVERS;27/01/2010;Outils pour basculer des Tiers en installateurs;Pour les Tiers NON relies a des clients ou collectifs;;;Menu fichiers - installateur - bouton bascule;Autorise administrateur;;;;;Modification;;2010
11155;STOCK;25/01/2010;Possibilité en bon interne de saisir une quantité supérieure a 999;;;;Ok;;;;;;Modification;;2010
11158;APPAREIL;25/01/2010;Outils de correction nom installateur de la fiche appareil;;;;Menu fichiers - installateur - bouton correction;Autoriser administrateur;;;;;Modification;;2010
11159;APPAREIL;25/01/2010;Paramètres afin d'obliger a saisir le nom d'installateur dans la fiche appareil à partir du fichier installateur;;;;Paramètres généraux - onglet divers - onglet page 1;Cocher nom installateur appareil NON libre;;;O;;Modification;;2010
11161;APPAREIL;25/01/2010;Paramètre pour ne pas mettre à jour la durée garantie appareil selon nomenclature;;;;Paramètres généraux - onglet divers - onglet page 1;Cocher durée garantie appareil libre;;;O;;Modification;;2010
11154;DIVERS;23/01/2010;Editer la liste des foumules et options contrat cumulées avec qté montant et prix moyen;;;;Menu contrat - statistiques - générales - répartition contrat;;;;;;Modification;;2010
11157;STOCK;22/01/2010;Possibilité de rendre obligatoire la sous famille en fiche article;;;;Paramètres généraux - Stock;;;;O;;Modification;;2010
11156;COMPTABILITE;19/01/2010;Ventilation par famille de produit différente pour les ventes comptoirs.;Création dans les familles d'une ventilation comptoir;;;Ok;;;;;;Modification;;2010
11148;INTERVENTION;18/01/2010;Bloquer une création intervention pour un client en intervention interdite;;;;Paramètres généraux - onglet BI - onglet saisie;Cocher bloquer intervention interdite;;;O;;Modification;;2010
11149;FACTURE;18/01/2010;Edition de l'appareil sur les devis.;;;;Ne pas oublier de cocher appareil sur devis dans paramètres généraux - facture - devis;;;;O;;Modification;;2010
11152;STOCK;18/01/2010;Lors de la MAJ stock agence - rajout de champ modifie tels que - genre - sous famille-ne pas éditer - saisir libellé..;;;;Ok;;;;;;Modification;;2010
11153;DIVERS;18/01/2010;Modification de état attestation aft;;;;Ok;;;;;;Modification;;2010
11151;APPAREIL;17/01/2010;En cas de modification appareil. alerte avec reprise possible de l'ancien;;;;Ok;;;;;;Modification;;2010
11414;CLIENT;17/01/2010;Edition attestation entretien. éditer pour le mode evacuation soit le type evacuation ou l'application de la;Fiche appareil. pour l'application éditer soit le code soit le libellé;;;Paramètres généraux - onglet divers - onglet page 3;;;;O;;Modification;;2011
11147;FACTURE;15/01/2010;Dans le corps de facture. ajouter la civilite en reprise nom et adresse propriétaire;;;;Ok;;;;;;Modification;;2010
11150;FACTURE;15/01/2010;En saisie du corps de facture en reprise propriétaire ajout de la civilite;En saisie du corps de facture la lettre g est la reprise gerant;La lettre u est la reprise ouvrage;;Ok;;;;;;Modification;;2010
11141;CONTRAT;13/01/2010;Indicateur retour + rappel + escalade brut nb v2/nb v1 sans tenir compte de histo contrat;;;;Ok;;;;;;Modification;;2010
11144;STOCK;13/01/2010;Edition commande soldée. choix du prix (net ou brut);;;;Ok;;;;;;Modification;;2010
11145;CONTRAT;13/01/2010;Ajouter dans échéance et relance le batiment;;;;Ok;;;;;;Modification;;2010
11146;PLANNING AUTO;13/01/2010;Signaler les clients avec date arrêt contrat;;;;Ok;;;;;;Modification;;2010
11143;STOCK;12/01/2010;Integration du catalogue Vf Confort;;;;Ok;;;;;;Modification;;2010
11142;INDICATEUR;12/01/2010;Modification taux de retour. ne pas tenir compte du contrat;;;;Ok;;;;;;Modification;;2010
10951;FACTURE;11/01/2010;Devis commerce: voir la limite devis en jour et mois pour édition;Afficher coordonnes affaire suivi dans écran devis;;;Ok;;;;;;Modification;;2009
11082;CONTROLE OBLIGATOIRE;08/01/2010;Saisie des attestations entretien avec les mesures à partir de la fiche appareil ou en saisie retour;;;;Ok;;;;;;Modification;;2009
11139;FACTURE;07/01/2010;Statistiques intervention cumulées par mois;;;;Facture - barre outils - statistiques intervention;;;;;;Modification;;2010
11140;STOCK;07/01/2010;Integration du catalogue Grohe;;;;Ok;;;;;;Modification;;2010
11081;CONTROLE OBLIGATOIRE;07/01/2010;Possibilité d'éditer des attestations entretien vierge;;;;Menu divers;;;;;;Modification;;2009
11079;CONTROLE OBLIGATOIRE;06/01/2010;Possibilité de paramètrer le format d'attestation d'entretien;;;;Menu paramètres édition - onglet attestation;;;;O;;Modification;;2009
11080;CONTROLE OBLIGATOIRE;06/01/2010;Editer l'attestation entretien obligatoire avec les BI;Dans le cas ou l'intervention est un entretien sous contrat ou hors contrat;;;Menu paramètres généraux - onglet BI - onglet édition;"""Cocher la case """"édition attestation entretien obligatoire avec bi""""""";;;O;;Modification;;2009
11096;CONTROLE OBLIGATOIRE;06/01/2010;Création possible d'une bibliotheque de recommandations;;;;Menu fichiers généraux - onglet libellé 2 - onglet recommandation entretien;;;;;;Modification;;2009
11078;CONTROLE OBLIGATOIRE;05/01/2010;Saisir le tableau des rendements chaudiere selon type, année, puissance...;;;;Menu fichiers - nomenclature - gérer - rendement;;;;;;Modification;;2009
