N fonctionnalité;THEME;Date Fait;Demande 1;Demande 2;Demande 3;Demande 4;Résultat 1;Résultat 2;Résultat 3;Résultat 4;Paramètre Modifié;Ecran/Impression;Type;Ticket;Version
12491;COLLECTIF;23/05/2017;L'agence peut être modifiée en création de facture tant que le N° facture n'est pas attribué;Soumis à autorisation.;;;Paramètres Autorisation - Gestion - Onglet Facture;;;;O;Ecran;Nouveauté;;2017_06
12479;FACTURE;22/05/2017;Temps de production. Cumul par collectif et Tiers;;;;OK;;;;;Impression;Modification;;2017_06
12484;FACTURE;22/05/2017;Faire apparaitre l'adresse Mail du payeur dans l'écran Facture.;;;;OK;;;;;;Modification;;2017_06
12486;INTERVENTION;22/05/2017;L'origine de l'appel est libre.;;;;OK;;;;N;;Modification;;2017_06
12487;INTERVENTION;22/05/2017;La date et heure d'appel peuvent être facultatives;;;;Paramètre Généraux - Intervention - Onglet Saisie 2;;;;O;;Nouveauté;;2017_06
12488;INTERVENTION;22/05/2017;La date et heure d'appel peuvent être automatiques;;;;Paramètres Généraux - Intervention - Onglet Saisie 2;;;;O;;Correction;;2017_06
12489;FACTURE;22/05/2017;L'écran de facture a été modifié.;Les champs Client, Date, Facture... sont alignés;;;OK;;;;N;Ecran;Nouveauté;;2017_06
12483;PRELEVEMENT;20/05/2017;Liste des anomalies payeur prélèvement selon payeur contrat;;;;Menu Contrat - Prélèvement - Liste vérification payeur;;;;;Impression;Nouveauté;;2017_06
12468;PRELEVEMENT;19/05/2017;Possibilité de supprimer les coordonnées bancaires du client en cas d'arrêt de prèlèvement ou de mettre accord de prélèvement à NON;;;;OK;;;;;;Modification;;2017_06
12481;FACTURE;19/05/2017;Historique des relances Devis.;Icones dans l'écran Factures afin de saisir des dates de relances de devis, des moyens et statuts;;;OK;;;;;Ecran+Impression;Nouveauté;;2017_06
12482;FACTURE;19/05/2017;Paramètrer automatiquement des dates de relances devis;;;;Paramètres Généraux - Facture - Onglet Devis;;;;O;Ecran;Nouveauté;;2017_06
12478;FACTURE;18/05/2017;Réintégration des pièces pour un avoir avec gestion d'un stock voiture.;Possibilité de réintégrer les pièces dans le magasin ou dans la voiture;;;OK;;;;;;Modification;7229;2017_06
12480;FICHIERS GENERAUX;18/05/2017;Paramétrer des Moyens et Statuts de relance de Devis;;;;Menu Fichiers Généraux - Onglet Relance Devis;;;;;Ecran;Nouveauté;;2017_06
12477;PERSONNEL;17/05/2017;Absence le même jour. Possibilité de lancer le traitement pour une agence, pour une équipe;;;;OK;;;;;Ecran;Modification;7612;2017_06
12475;COMPTABILITE;16/05/2017;Edition journaux. Editer la période choisie;;;;OK;;;;;Impression;Modification;;2017_06
12476;CONTRAT;16/05/2017;Edition liste échéance contrat. Editer la période choisie;;;;OK;;;;;Impression;Modification;;2017_06
12467;PRELEVEMENT;15/05/2017;Ne pas créer d'échéancier si date d'arrêt de contrat renseignée;;;;OK;;;;;;Modification;;2017_06
12469;PLANNING AUTO;10/05/2017;Faire apparaitre l'alerte Appel de la fiche client dans l'écran de résultat du planning;;;;OK;;;;;Ecran;Nouveauté;;2017_06
12470;COLLECTIF;10/05/2017;Edition situation d'intervention. Editer en priorité l'appareil principal;;;;OK;;;;;;Correction;;2017_06
12471;COLLECTIF;10/05/2017;Edition situation d'intervention. Ajouter Civilité et Prénom du locataire;;;;OK;;;;;;Nouveauté;;2017_06
12472;CLIENT;10/05/2017;Outils d'affectation Origine Client. Ajouter un critère agence.;;;;OK;;;;;Ecran;Modification;;2017_06
12473;MAILING;10/05/2017;Ajouter critère pour exclure les clients avec ou sans adresse mail;;;;OK;;;;;Ecran;Nouveauté;;2017_06
12474;FACTURE;10/05/2017;La remise globale peut être déterminée par un taux.;;;;OK;;;;;Ecran;Nouveauté;;2017_06
12466;FACTURE;09/05/2017;Prévoir une retenue de Garantie pour un Tiers;;;;OK;;;;;Ecran;Nouveauté;;2017_06
12465;COLLECTIF;28/04/2017;Possibilité d'appliquer une durée de contrat en Mois;;;;PARAMETRES GENERAUX - Contrat - Onglet Collectif;;;;O;Ecran;Nouveauté;;2017_06
12463;PLANNING AUTO;27/04/2017;Plannifier par défaut en Nombre ou Durée;;;;Paramètres Généraux - Contrat - onglet Planning;;;;O;Ecran;Nouveauté;;2017_06
12464;PLANNING AUTO;27/04/2017;Cocher par défaut certains choix;Contrat Obligatoirement réglé, Tenir compte des quotas d'absence, Tenir compte logement Vide, Déjà programmé dans fiche client;;;Paramètres Généraux - Contrat - onglet Planning;;;;O;;Nouveauté;;2017_06
12461;FACTURE;26/04/2017;Création Vente Comptoir. Possibilité de récupérer dans le corps des références scannées par une douchette.;;;;PARAMETRES GENERAUX - Stock - Page 1 - Cocher Utilisation Douchette;;;;;;Nouveauté;;2017_06
12458;COMPTABILITE;25/04/2017;Lien Comptable. Possibilité d'attribuer un journal de vente différent selon la tva. (si un seul taux de TVA);Si plusieurs taux de tva dans la facture le journal par défaut sera utilisé;;;PARAMETRES COMPTABILITE - Onglet Journaux;;;;O;Ecran;Nouveauté;;2017_06
12459;COMPTABILITE;25/04/2017;Lien comptable. Le compte de ventilation TVA peut être déterminé pour chaque taux de TVA.;Saisir le compte entier, le traitement ne prenant pas en compte l'extension;;;PARAMETRES COMPTABILITE - Onglet TVA - Cocher Compte TVA dans la table TVA;;;;O;Ecran;Nouveauté;;2017_06
12460;PLANNING AUTO;25/04/2017;Construction planning. Ajout de critères facultatifs dans l'onglet Autre.;Client avec adresse Mail;Client avec tél mobile;;OK;;;;;;Nouveauté;;2017_06
12462;PLANNING HEBDO;25/04/2017;Possibilité de voir sur une carte les clients ayant des interventions(3 jours maxi) ou des VE à venir (2 mois maxi) à partir de l'adresse ;d'un client dans un rayon de 15km maxi.;Ce traitement est matérialisé par une carte de France bleue une fois un client trouvé par le bouton Appel Client;;PARAMETRES GENERAUX - Divers - Onglet page 2 - Cocher Géolocalisation VE;;;;O;Ecran;Nouveauté;;2017_06
12457;CLIENT;24/04/2017;Possibilité de voir sur une carte les clients ayant des interventions(3 jours maxi) ou des VE à venir (2 mois maxi) à partir de l'adresse ;d'un client dans un rayon de 15km maxi.;Dans l'écran de recherche client ce traitement est matérialisé par une carte de France bleue;;PARAMETRES GENERAUX - Divers - Onglet page 2 - Cocher Géolocalisation VE;;;;O;Ecran;Nouveauté;;2017_06
12454;CLIENT;22/04/2017;Possibilité de piocher une adresse dans le fichier des communes Françaises.;Un icone sous la forme d'une carte de la france permet de chercher et récupérer une adresse.;;;PARAMETRES GENERAUX - DIVERS - Onglet Page 3;;;;O;;Nouveauté;;2017_06
12455;INTERVENTION;20/04/2017;Possibilité d'interdire l'envoi d'un SMS pour un client (onglet entretien), pour les clients d'un Tiers (onglet divers);;;;OK;;;;;;Nouveauté;;2017_06
12456;INTERVENTION;20/04/2017;Envoyer les SMS que pour les clients dont la VE est confirmée.;;;;PARAMETRES GENERAUX - SMS;;;;O;;Nouveauté;;2017_06
12451;APPAREIL;18/04/2017;Outils pour changer le code nomenclature de plusieurs clients par un autre code nomenclature;;;;FICHIERS - Nomenclature - Bouton Changer le code nomenclature pour des clients;;;;;Ecran;Nouveauté;;2017_06
12452;COMPTABILITE;18/04/2017;Une facture en modification ne passe pas en lien comptable;;;;OK;;;;;;Nouveauté;;2017_06
12453;CLIENT;18/04/2017;Optimisation de l'outils liste des clients avec caractère interdit;;;;OK;;;;;;Correction;;2017_06
12450;PLANNING AUTO;17/04/2017;S'il existe une gestion des compétences dans le Personnel, possibilité de signaler lors de le construction du planning les problèmes;de compétences liées au client;;;OK;;;;;Ecran;Nouveauté;;2017_06
12447;FICHIERS GENERAUX;13/04/2017;Mise à disposition de toutes les rues des communes Françaises..;;;;Menu les Fichiers - Codes Postaux - Bouton Rue France;;;;;;Nouveauté;;2017_06
12448;CLIENT;13/04/2017;Possibilité d'alerter ou bloquer si Ville et/ou  Rue non reconnue dans les communes Françaises.;;;;Paramètres généraux - Divers - Onglet Page 3;;;;O;;Nouveauté;;2017_06
12449;FICHIERS GENERAUX;13/04/2017;Correction orthographe Rue et Ville. Possibilité d'utiliser le fichier des communes Françaises.;;;;OK;;;;;;Nouveauté;;2017_06
12416;FACTURE;10/04/2017;Gestion des impayés. Prendre en compte également les factures en attentes.;;;;OK;;;;;;Modification;;2017_06
12446;PLANNING AUTO;09/04/2017;Prend en compte les absences et charge de travail existantes.;La prise en compte peut être paramétrée par défaut;;;Paramètres Généraux - Contrat - onglet Planning;;;;O;Ecran;Nouveauté;;2017_06
12444;CLIENT;07/04/2017;Rechercher un client par adresse MAIL;;;;OK;;;;;Ecran;Nouveauté;;2017_06
12445;CONTRAT;07/04/2017;Liste VE restant à faire. Toujours éditer la date de programmation.;;;;PARAMETRES GENERAUX - Contrat - Onglet Général;;;;O;Ecran;Modification;;2017_06
12442;PRELEVEMENT;05/04/2017;Pas de création d'échéancier si le RIB est incomplet (manque Banque ou Guichet ou Compte....);;;;OK;;;;;;Correction;;2017_06
12443;PRELEVEMENT;05/04/2017;Outils pour éditer les RIB comportant une anomalie (incomplet, incorrect...);;;;Menu Les fichiers - Domiciliation Bancaire - Traitement - Bouton Anomalie RIB;;;;;Ecran;Nouveauté;;2017_06
12437;PRELEVEMENT;04/04/2017;Edition liste prélèvements. Possibilité de rejeter selon le statut.;;;;Menu Les Contrats - Prélèvement - Bouton Imprimer liste - Choix Liste;;;;;Ecran;Modification;;2017_06
12438;COLLECTIF;04/04/2017;Situation Intervention. Prendre ou Rejeter parties communes;;;;OK;;;;;Ecran;Modification;;2017_06
12439;COLLECTIF;04/04/2017;Outils pour affecter une date de prochain entretien et/ou mois prévisionnel aux locataires d'un collectif avec critère facultatif;sur le batiment;;;Menu Les collectifs - Divers - Divers - Attribuer Mois Prévisionnel;;;;;Ecran;Nouveauté;;2017_06
12440;COLLECTIF;04/04/2017;Outils pour affecter des lignes de contrat aux locataires.;Ne fonctionne que dans le cas ou le paramètre Détaillé par ligne contrat est coché.;;;Menu les Collectifs - Divers - Divers - Bouton Attribuer ligne Tarif;;;;;Ecran;Nouveauté;;2017_06
12441;CONTRAT;04/04/2017;Provisions classiques. Le système n'éditait pas de provisions avec le critère Test Facture existante.;;;;OK;;;;;;Correction;;2017_06
12432;CLIENT;31/03/2017;Ecran des contacts. Ajouter une liaison avec un document (Facture, Devis, Avoir...);;;;OK;;;;;Ecran;Modification;;2017_06
12434;FACTURE;31/03/2017;En création de Devis, message d'alerte si la pièce est épuisée fournisseur.;;;;PARAMETRES - GENERAUX - STOCK - Onglet Devis;;;;;;Nouveauté;;2017_06
12435;COLLECTIF;31/03/2017;Lors de changement de statut pour passer des collectifs en hors contrat, les appareils ne passaient pas en hors contrat.;;;;OK;;;;;;Correction;;2017_06
12422;COLLECTIF;30/03/2017;Exploitation. Edition récapitulatif taches. Ajouter Adresse.;;;;OK;;;;;Impression;Modification;;2017_06
12433;PRELEVEMENT;30/03/2017;Possibilité de créer en masse les échéanciers selon un mois de contrat.;Soumis à autorisation;;;PARAMETRES - Autorisation - Gestion - Onglet Prélèvement;;;;O;Ecran;Nouveauté;;2017_06
12436;CONTRAT;30/03/2017;Echéance et facturation contrat possibilité de d'interdire ou autoriser les clients avec ou  sans prélèvements;;;;PARAMETRES - GENERAUX - RIB - Onglet liaison Facture;;;;O;Ecran;Nouveauté;;2017_06
12431;FACTURE;29/03/2017;Création facture petit collectif.;Le système ne prenait pas en compte les dates de blocage de comptabilité pour la date de facture;;;OK;;;;;;Correction;;2017_06
12429;COLLECTIF;28/03/2017;Outils affectation appareils pour un collectif. Ajout d'un filtre facultatif sur le Batiment.;;;;OK;;;;;Ecran;Modification;;2017_06
12430;PRELEVEMENT;28/03/2017;Ajouter des prélèvements à une facture existante comportant déjà des règlements;;;;PARAMETRES GENERAUX - RIB - Onglet liaison facture;;;;O;;Modification;;2017_06
12426;COLLECTIF;27/03/2017;Outils pour contrôler les arrondis des montants de contrat collectifs;;;;Menu Collectif - Bouton Révision;;;;;;Nouveauté;;2017_06
12427;PLANNING HEBDO;27/03/2017;Ajout du Code et nom collectif après choix du Client.;;;;OK;;;;;Ecran;Modification;;2017_06
12428;COLLECTIF;27/03/2017;Ajouter dans l'écran des récap taches exploitation, Rue, Code Postal et Ville.;;;;OK;;;;;Impression;Modification;;2017_06
12425;CLIENT;24/03/2017;Modification de l 'écran de recherche client.;;;;OK;;;;;Ecran;Modification;;2017_06
12423;DIVERS;14/03/2017;Certains automates s'effectuent désormais avec un utilisateur.;Contrôle Client - Contrôle Collectif - Mise à jour Tacite reconduction;Mise à jour Planning - Contrôle Facture - Bascule Tarif - Stock Dossier;;Paramètres généraux - Divers - Onglet Automatimes 1 et Automatismes 2;;;;O;Ecran;Modification;;2017_06
12424;STOCK;14/03/2017;Possibilité d'imposer un code prix pour les ventes comptoir;;;;Paramétres généraux - Stock - Onglet Page 2;;;;O;Ecran;Modification;;2017_06
12421;APPAREIL;01/03/2017;Possibilité de distinguer la durée d'entretien pour les collectisf Privé/Public selon le type d'appareil.;Lancer un contrôle client si modification des durées.;;;Fichiers - Nomenclature - Bouton Type;;;;;Ecran;Modification;;2017_06
12420;PERSONNEL;24/02/2017;Absence le même jour. Possibilté de saisir un libellé libre;;;;OK;;;;;Ecran;Nouveauté;7182;2017_06
12417;PERSONNEL;22/02/2017;Ajouter un symbole pour les Commerciaux et Monteurs qui apparaitront dans le planning hebdo;;;;Fichier -Personnel - Bouton Type;;;;;;Nouveauté;;2017_06
12418;CLIENT;21/02/2017;Vérifier l'existence des codes fichiers généraux de la fiche client (Installation, type clientèle....) en modification et création client;;;;OK;;;;;;Correction;;2017_06
12419;CLIENT;21/02/2017;Edition de liste des clients comportant une anomalie (type clientèle inexistant...);;;;Les clients - Divers - Contrôle client - Onglet Page 3 - Bouton Liste Anomalies Client;;;;;Ecran+Impression;Nouveauté;;2017_06
12414;CLIENT;17/02/2017;Possibilité de bloquer ou alerter si pas d'Email dans la fiche client;;;;Paramètres Généraux - Divers - Onglet Page 2;;;;O;Ecran;Nouveauté;;2017_06
12413;COLLECTIF;16/02/2017;La gestion des Formules de révision (Création, Modification, Annulation) est soumise à autorisation;;;;PARAMETRES AUTORISATION - Onglet Collectif;;;;O;Ecran;Nouveauté;;2016
12415;INTERVENTION;16/02/2017;Dans le cas ou l'origine de l'appel est obligatoire, il est possible de passer outre si le client n'a aucun Tiers.;Dans ce cas renseigner une origine pas défaut dans les paramètres.;;;Paramètres généraux - Intervention - Onglet Saisie 2;;;;O;Ecran;Nouveauté;;2017_06
12412;STOCK;15/02/2017;Fiche article.  Bouton Gérer Fournisseur.;Reprise des prix net, brut et valeur de la remise.;;;OK;;;;;;Modification;;2017_06
12411;STOCK;13/02/2017;Outils pour attribuer un montant d'éco-taxe selon Marque, Famille, Sous-famille;;;;Menu le Stock - Bouton Outils - Bouton Attribuer Eco-Taxe;;;;;;Nouveauté;;2017_06
12410;COLLECTIF;30/01/2017;Edition rapport intervention par Mobilité.;Envoi d'un seul Mail de tous les rapports d'une journée pour un même collectif;;;Collectif - Onglet généralités - Onglet Mail PDA;;;;;Ecran;Nouveauté;;2017_06
12408;FACTURE;27/01/2017;Edition de relevé impayés. Mise à jour des historiques relances également pour les payeurs n'ayant pas Relevé obligatoire.;;;;PARAMETRES GENERAUX - Facture - Onglet Divers 6;;;;O;;Modification;;2017_06
12409;FACTURE;27/01/2017;Liste des impayés avec date de VE programmée;;;;OK;;;;;Impression;Modification;;2017_06
12402;FACTURE;26/01/2017;Possibilité d'autoriser un montant de TVA négatif;;;;PARAMETRES GENERAUX - Facture - Onglet Divers ;;;;O;;Modification;;2017_06
12407;COLLECTIF;26/01/2017;Situation intervention. Un seul traitement pour visualiser et éditer le détail et le cumul.;Dans édition cumul, ajout du nbre de double absences avec VE.;;;OK;;;;;Ecran+Impression;Modification;;2016
12403;COLLECTIF;25/01/2017;Outils Annulation locataires - Changement de statut;Nouvel écran pour le traitement;Les locataires concernés sont affichés dans un écran dans lequel il est possible d'exclure certains dossiers;;OK;;;;;Ecran;Modification;;2017_06
12400;CONTRAT;24/01/2017;Facture Petit Collectif. Possibilité de saisir les dates de contrat souhaitées;;;;PARAMETRES GENERAUX - CONTRAT - Onglet Individuel - Onglet Page 4;;;;O;;Modification;;2017_06
12401;CONTRAT;24/01/2017;Facture Petit Collectif. Affichage de la liste des clients concernés dans l'écran de creéation facture.;;;;OK;;;;;Ecran;Modification;;2017_06
12405;FACTURE;24/01/2017;Liste des Devis selon Intervention. Ajout d'un critère de délai dépassé ou non.;ATTENTION le critère ne fonctionne que si le délai est renseigné.;;;LES FACTURES - Bouton Edition - Bouton Devis Intervention;;;;;Ecran;Modification;;2017_06
12404;COLLECTIF;24/01/2017;Outils pour modifier ou créer des fiches collectif par fichier externe;;;;Collectif - Bouton Récupération;;;;;;Nouveauté;;2017_06
12397;INTERVENTION;23/01/2017;En saisie intervention, le système ne prenait plus en compte les absences matin ou après-midi du technicien.;Il faut lancer dans PERSONNEL le traitement Contrôle Absence afin de mettre à jour les absences saisies avant la correction.;;;OK;;;;;;Correction;;2017_06
12399;INTERVENTION;23/01/2017;Saisie intervention. Possibilité de ne pas avoir le message Technicien Absent sur chaque champ saisi mais à la validation finale.;Les champs saisis sont Technicien, période,Heure;;;PAREMETRES GENERAUX - Onglet Saisie 2 - Cocher Test absence à la Validation ;;;;O;;Nouveauté;;2017_06
12394;COMPTABILITE;21/01/2017;Lien comptable. Possibilité de différencier les individuels, petit collectif, collectif privé et public;;;;PARAMETRES COMPTABILITE - ONGLET Comptes généraux;;;;O;;Modification;;2017_06
12398;CLIENT;20/01/2017;Facture de contrat pour un client hors-contrat;Supprimer le motif de résiliation dans la fiche du client si précédemment renseigné;Paramètre pour ne pas supprimer le motif;;PARAMETRES GENERAUX - FACTURE - ONGLET CONTRAT;;;;O;;Nouveauté;;2017_06
12389;CLIENT;20/01/2017;Outils pour mettre à jour les taux ou code TVA dans les fiches client et appareil;;;;Les client - Divers - Contrôle client - Page 2 - Correction TVA;;;;;;Modification;;2017_06
12390;CLIENT;20/01/2017;En gestion de contrat appareil, si l'appareil est obligatoire, il était impossible de créer l'appareil si la fiche client est en ;mode modification;;;OK;;;;;;Correction;;2017_06
12391;FACTURE;20/01/2017;Ajout de la colonne montant réglement dans l'écran des annulations facture.;;;;OK;;;;;Ecran;Modification;;2017_06
12392;FACTURE;20/01/2017;Liste des factures. Ajout du critère Soldé / non soldé;;;;Les factures - bouton édition - bouton liste;;;;;Ecran;Nouveauté;;2017_06
12393;COLLECTIF;20/01/2017;Récupération collectif.;Ajout de la partie commune, et de 4 champs ligne de contrat;;;OK;;;;;;Modification;;2016
12395;COLLECTIF;20/01/2017;Révision avec formule. Possibilité de modifier le résultat (taux);;;;OK;;;;;;Modification;;2017_06
12388;FACTURE;20/01/2017;Outils pour éditer la liste des doublons de documents;Même N° facture (devis, avoir...)  Même Lettre mais clé différente;;;Les factures - bouton Anomalies - bouton Doublon Document;;;;;Ecran;Nouveauté;;2017_06
12396;FACTURE;19/01/2017;Les couts (MO, déplacement...) n'étaient pas conservés lors de la validation de la facture;;;;OK;;;;;;Correction;;2017_06
12379;STOCK;15/01/2017;Rendre le correspondant obligatoire dans les commandes;;;;PARAMETRES GENERAUX - STOCK - ONGLET COMMANDE - Onglet Commande 2;;;;O;Ecran;Nouveauté;;2017_06
12387;COLLECTIF;13/01/2017;Récupération collectif (logement). Ajout de 3 champs;Email + Locataire/Pro + Observation;;;OK;;;;;;Modification;;2017_06
12373;APPAREIL;10/01/2017;Ajouter dans la nomenclature et appareil le type de Gaz pour les PAC;;;;OK;;;;;Ecran;Nouveauté;;2017_06
12385;STOCK;09/01/2017;Outils pour attribuer les coefficient généraux de prix de vente à toute les familles;Attention. Soumis à autorisation (calcul prix de vente);;;MENU LE STOCK - ARTICLE - Bouton CALCUL;;;;;;Nouveauté;;2017_06
12386;PRELEVEMENT;09/01/2017;Possibilité de passer tous les prélèvements en récurrent.;;;;Paramètres Généraux - RIB - Cocher Tout récurrent.;;;;O;Ecran;Modification;;2017_06
12380;COLLECTIF;06/01/2017;Critéres de recherche collectif. Différencier la recherche Gérant, Propriétaire....;;;;Menu Les Collectif - Collectif;;;;;Ecran;Modification;6043;2017_06
12381;CONTRAT;06/01/2017;Liste des VE restants à faire. La date Programmée n'est éditée que s'il est supérieure à la date d'édition.;;;;OK;;;;;Impression;Modification;5596;2017_06
12382;FACTURE;06/01/2017;Interdire de saisir un montant de TVA négatif;;;;OK;;;;;;Correction;6845;2017_06
12383;CLIENT;06/01/2017;Ajouter dans le traceur modification client, la modification de la date de prochaine VE;;;;OK;;;;;Ecran;Modification;6755;2016
12384;INTERVENTION;06/01/2017;Saisie intervention avec test solde. Possibilité d'exclure le test si client ou tiers collectif privé et/ou oublic;;;;PARAMETRES GENERAUX - INTERVENTION - ONGLET SAISIE 3;;;;O;Ecran;Modification;;2017_06
12374;COLLECTIF;03/01/2017;Possibilité de modifier en masse un N° batiment dans les locataires;;;;MENU LES COLLECTIFS - DIVERS - DIVERS;;;;;Ecran;Nouveauté;;2017_06
12375;COLLECTIF;03/01/2017;Changement de statut locataires. Ajouter des critères adresse (Batiment, rue, ville);;;;OK;;;;;Ecran;Modification;;2017_06
12376;COLLECTIF;03/01/2017;Outils pour passer des individuels en collectif. Ajouter critère Batiment.;;;;LES COLLECTIFS - DIVERS - DIVERS;;;;;Ecran;Modification;;2017_06
12377;FACTURE;03/01/2017;Dupliquer un duplicata de devis. Ne pas récupérer le type duplicata sinon le nouveau devis n'est pas modifiable.;;;;OK;;;;;;Correction;;2017_06
12378;INTERVENTION;03/01/2017;Augmenter le nombre de caractères dans les observations historiques. Passer à 100 comme dans les factures;;;;OK;;;;;;Modification;;2016
12372;FACTURE;02/01/2017;Edition du Devis Opérationnel. Ajouter les notes concernant le Devis.;;;;OK;;;;;Impression;Nouveauté;;2016
12371;STOCK;20/12/2016;Réception de bon interne. le fichier est stocké dans un répertoire SAUVE à la fin du traitement.;;;;OK;;;;;;Modification;;2016
12367;STOCK;09/12/2016;Problème sur les prévisions client dans les commandes. les prévisions étaient mises à jour seulement dans le;Cas ou il n'y avait qu'un client pour la commande;;;Ok;;;;;;Correction;;2016
12368;STOCK;09/12/2016;Ajouter dans le menu stock un accès direct aux commandes;;;;Ok;;;;;Ecran;Modification;;2016
12369;STOCK;09/12/2016;Recherche Fournisseur.  Paramètrer le classement pas défaut (code ou raison sociale);Attention si modification de paramètres, lancer le contrôle dans l'écran de recherche Fournisseur;;;Paramètres généraux - stock - onglet page 4;;;;O;Ecran;Nouveauté;;2016
12370;PLANNING AUTO;09/12/2016;Construction planning auto. tenir compte ou NON des absences techniciens.;;;;Paramètres Généraux - Contrat - onglet Planning;;;;O;Ecran;Nouveauté;;2016
12366;COLLECTIF;30/11/2016;Gestion des locataires à partir de la fiche collectif.;Le système ne prenait pas en compte les droits (création, modification) de l'utilisateur;;;Ok;;;;;;Correction;;2016
12361;PLANNING HEBDO;28/11/2016;Planning graphique. possibilité de modifier/annuler des absences ou annotations à partir de l'écran par le clic droit.;;;;Ok;;;;;;Nouveauté;;2016
12362;CLIENT;28/11/2016;Les prévisions client ne tenait pas compte de l'affichage que sur un poste;;;;Ok;;;;;;Correction;;2016
12363;INTERVENTION;28/11/2016;Saisie intervention. alerte si entretien NON fait depuis un certain nbre de jour ou si entretien anniversaire dépassé;Le message peut s'afficher également sur l'écran du planning hebdo;;;Paramètres généraux - intervention - onglet saisie 1 - cocher alerte entretien;;;;O;;Modification;;2016
12364;APPAREIL;28/11/2016;Recherche appareil. possibilité de recherche par code tarif contrat sous condition d'être en mode de ;gestion contrat par appareil.;;;Ok;;;;;Ecran;Modification;;2016
12365;FACTURE;28/11/2016;Relance impayés. possibilité d'exclure les factures ayant fait l'objet d'une autre facture/intervention après leur;date d'impayée;;;Ok;;;;;Ecran;Modification;;2016
12360;CLIENT;26/11/2016;Afficher icone orange pour un individuel hors-contrat avec une facture contrat impayée;;;;Paramètres généraux - contrat - individuel - page 4;;;;O;Ecran;Nouveauté;;2016
12359;CONTRAT;23/11/2016;Possibilité d'interdire l'édition de proposition ou formulaire de contrat;;;;Paramètres éditions - onglet Afnor;;;;O;Ecran;Modification;;2016
12355;FACTURE;22/11/2016;Règlement rapide sur devis. passer le devis en accepté;;;;Paramètres généraux - facture -onglet devis;Cocher mettre le devis en accepté lors d'un règlement;;;O;Ecran;Modification;;2016
12358;CLIENT;22/11/2016;Edition formulaire contrat. forcer par défaut Afnor ou Atandard;;;;Paramètres édition - onglet Afnor;;;;O;Ecran;Modification;;2016
12357;PLANNING HEBDO;21/11/2016;Possibilité de créer des annotations (clic droit) pour le technicien à partir d'un écran graphique;;;;Ok;;;;;;Nouveauté;;2016
12353;CLIENT;17/11/2016;Fiche client. ajout du statut Email (refus, pas d'Email....);;;;Ok;;;;;Ecran;Modification;;2016
12354;INTERVENTION;17/11/2016;Edition planning. possibilité de ne pas éditer la recap après le détail;;;;Paramètres généraux - intervention - onglet édition autre;;;;O;Ecran;Modification;;2016
12350;APPAREIL;16/11/2016;Modification état des mesures froid (au norme cerfa 15947);;;;Ok;;;;;Impression;Modification;;2016
12351;APPAREIL;16/11/2016;Impossible de saisir des mesures froid si l'appareil n'est pas éligible;;;;Cocher dans la nomenclature correspondante la case contient  cfc....;;;;;;Modification;;2016
